{"$schema":"../../.ai/schemas/asset-manifest.schema.json","assetId":"CAL-STONEWOOD-V1-39FAAE34C4CD","createdAtUtc":"2026-09-05T12:18:53.0143063\u002B00:00","createdBy":"riftward-dotnet-asset-generator","generationBindingMode":"canonical-event-v1","generationReceipt":"assets/receipts/CAL-STONEWOOD-V1-39FAAE34C4CD/01M1RR3QZPNSGBTG44ZCYE1FVX.json","generationReceiptSha256":"56ea630f990b10f173430e4beb1a5fd2a093cc05869573e54a08eb6988955974","generationRunId":"01M1RR3QZPNSGBTG44ZCYE1FVX","generator":{"executionMode":"local","generatorSourceSha256":"4923778143b2491b6c4ea70f3343cded86fda332badee47f0b9fc1ba739d9887","kind":"procedural","model":null,"modelArtifactSha256":null,"modelVersion":null,"seed":1592594996,"tool":"riftward-dotnet-asset-generator","toolchainPin":"dotnet-sdk:10.0.110","version":"1"},"inputs":[{"allowedUse":"internal-specification","creativeInfluence":true,"id":"SPEC-CALIBRATION-V1","license":"Project-owned internal specification.","origin":"Project-authored numeric calibration specification.","originClass":"internal-specification","path":"assets/specs/3d/CAL-STONEWOOD-V1.calibration-v1.json","referenceUseReviewed":true,"rightsEvidence":"Created inside the project without external creative media.","sha256":"39faae34c4cd515cb724a8ef1e2e4bee159a232136218fbb8afd8edd52db2cf8"},{"allowedUse":"generation-input","creativeInfluence":false,"id":"GENERATOR-SOURCE-1","license":"Repository project license.","origin":"Project-authored F# generator source.","originClass":"agentic-synthetic","path":"tools/RiftHarness/AssetJobJournal.fs","referenceUseReviewed":true,"rightsEvidence":"Created inside the project without external creative media.","sha256":"dc8b903519e9285d8d2d7789d7e4163238e3c408b9308e8e1e71aef11a050263"},{"allowedUse":"generation-input","creativeInfluence":false,"id":"GENERATOR-SOURCE-2","license":"Repository project license.","origin":"Project-authored F# generator source.","originClass":"agentic-synthetic","path":"tools/RiftHarness/BlenderCalibration.fs","referenceUseReviewed":true,"rightsEvidence":"Created inside the project without external creative media.","sha256":"1fe0615f8c880b8e0d027c91b451ca0019a845002c4d9f886380d6008bbfcc8c"},{"allowedUse":"generation-input","creativeInfluence":false,"id":"GENERATOR-SOURCE-3","license":"Repository project license.","origin":"Project-authored F# generator source.","originClass":"agentic-synthetic","path":"tools/RiftHarness/DotnetAssetGenerator.fs","referenceUseReviewed":true,"rightsEvidence":"Created inside the project without external creative media.","sha256":"92179a9ef2ee7c1e3003305833aafb040b28a1da8ffa3f30c8f2fb981cd8084d"},{"allowedUse":"technical-calibration","creativeInfluence":false,"id":"TOOLCHAIN-DOTNET-SDK","license":"Repository technical metadata.","origin":"Project toolchain lock metadata.","originClass":"technical-nonexpressive","path":"toolchain.lock.json","referenceUseReviewed":true,"rightsEvidence":"Versioned project toolchain record.","sha256":"4310f9c405f261a698235c835bc56cb3d01821a44936b6146fc009e51df933cf"}],"licenseBasis":{"commercialUseReviewed":false,"inputRights":"Project-authored numeric specification and generator sources only.","modelTerms":"No model is used by deterministic procedural generation.","outputPolicy":"Quarantine only; independent reviews are still required.","reviewedAtUtc":null,"termsEvidenceArtifact":null},"outputs":[{"bytes":270344,"mediaType":"model/gltf-binary","path":"assets/quarantine/3d/CAL-STONEWOOD-V1-39FAAE34C4CD/family.glb","sha256":"6dddf5efed35fc29676f22ef4b7d107637506a45dc148ff44453c0627055f178","technicalMetrics":{"artifactRole":"geometry-family"}},{"bytes":2074363,"mediaType":"image/png","path":"assets/quarantine/3d/CAL-STONEWOOD-V1-39FAAE34C4CD/preview.png","sha256":"69adc8133c2bb9f5f78035be22c9dca83a7ebe84d18bc35758b370c89ee6fcdd","technicalMetrics":{"artifactRole":"inspection-preview","height":540,"width":960}},{"bytes":3711,"mediaType":"application/json","path":"assets/quarantine/3d/CAL-STONEWOOD-V1-39FAAE34C4CD/technique.json","sha256":"6a063317489ccd8a979e4fda28a26b6bd08bb717508fa083fbef96131de305e4","technicalMetrics":{"artifactRole":"technique-report"}}],"prompts":null,"purpose":"Neutral procedural three-module geometry calibration family for technical validation.","reviews":[],"schemaVersion":1,"specSha256":"39faae34c4cd515cb724a8ef1e2e4bee159a232136218fbb8afd8edd52db2cf8","status":"quarantine","supersedes":[],"transformations":[{"operation":"calibration-v1-geometry","parametersSha256":"39faae34c4cd515cb724a8ef1e2e4bee159a232136218fbb8afd8edd52db2cf8","tool":"riftward-dotnet-asset-generator","version":"1"},{"operation":"gltf2-direct-write","parametersSha256":"81d7fcdea55de043c85ff8494bdb0f484a90e2a1de9b651b654123ba7f9db2c8","tool":"riftward-dotnet-asset-generator","version":"1"},{"operation":"cpu-preview-v1","parametersSha256":"c25bac11724a0f293f56460e157bc554e1672e75c04a5919a2b847ecaa30d1ea","tool":"riftward-dotnet-asset-generator","version":"1"},{"operation":"png-encode-v1","parametersSha256":"a875004622ac3d9b76fb52b0b32a01a2a7f4e50911e2f2aa86a2dc89418c4a50","tool":"riftward-dotnet-asset-generator","version":"1"}]}
